{
  "protocol_version": "1.0",
  "workspace_id": "20000000-0000-4000-8000-000000000001",
  "epoch": "70000000-0000-4000-8000-000000000001",
  "asset_id": "70000000-0000-4000-8000-000000000007",
  "asset_revision": "1",
  "byte_length": "524289",
  "sha256": "0000000000000000000000000000000000000000000000000000000000000000"
}
